{
  "id": "shopify-polaris",
  "name": "Shopify Polaris",
  "org": "Shopify",
  "category": "design-system",
  "repo_url": "https://github.com/Shopify/polaris",
  "docs_url": "https://shopify.dev/docs/api/app-home/polaris-web-components",
  "license": "NOASSERTION (custom/MIT-ish on Shopify/polaris); MIT on Shopify/shopify-ai-toolkit",
  "summary": "Polaris is the most instructive split-personality case in this study. The classic artifact, Polaris React at github.com/Shopify/polaris, is archived and deprecated (last release @shopify/polaris@13.9.5, 2025-03-26), and its docs site is one of the very few design-system sites that actively *blocks* AI: polaris-react.shopify.com/robots.txt disallows GPTBot, ClaudeBot, Google-Extended, PerplexityBot and CCBot, and every page ships `<meta name=\"robots\" content=\"noai, noimageai\">`. There is no llms.txt, no CLAUDE.md, no .cursorrules anywhere in that monorepo. Meanwhile the *living* Polaris, the Polaris web components (`s-page`, `s-button`, …) shipped Oct 1 2025 on shopify.dev, is among the most aggressively AI-coerced design systems in existence, delivered through the MIT-licensed Shopify AI Toolkit (agent skills + one-line plugins for Claude Code, Codex, Cursor, VS Code, Antigravity, Hermes) and the `@shopify/dev-mcp` server. Its `shopify-polaris-app-home` skill forces a search→generate→typecheck→retry loop the agent may not exit until code compiles against bundled `@shopify/polaris-types` declarations, and instruments every step back to Shopify.",
  "ai_maturity": "ai-native",
  "maintenance": {
    "actively_maintained": true,
    "last_release": "@shopify/polaris@13.9.5 — 2025-03-26 (React, final); @shopify/dev-mcp@1.14.3 — 2026-07-16; shopify-ai-toolkit pushed 2026-07-27; @shopify/polaris-types@1.0.7 — 2026-04-29",
    "activity_note": "Shopify/polaris is ARCHIVED (archived:true via GitHub API, 6.1k stars, last push 2026-01-06) and its README is headed ‘Polaris React (⚠️ Deprecated)’. Active development moved to Polaris web components documented on shopify.dev and to Shopify/shopify-ai-toolkit (created 2026-04-01, 474 stars, pushed same-day as this research). So the *system* is very much alive; the *repo the world knows* is not."
  },
  "affordances": [
    {
      "type": "claude-skill",
      "name": "shopify-polaris-app-home (Shopify AI Toolkit skill)",
      "official": true,
      "audience": "consumers",
      "code_url": "https://github.com/Shopify/shopify-ai-toolkit/tree/HEAD/skills/shopify-polaris-app-home",
      "docs_url": "https://shopify.dev/docs/apps/build/ai-toolkit",
      "description": "The flagship consumption affordance. A SKILL.md (320 lines, v1.12.1) plus `scripts/search_docs.mjs`, `scripts/validate.mjs` and bundled `assets/types` (@shopify/polaris-types, @shopify/app-bridge-types, preact .d.ts). It hard-gates every response behind a search call and a validation call, embeds a full component prop catalogue as few-shot exemplars, and ships PostToolUse telemetry hooks in its own frontmatter.",
      "notes": "Sibling skills exist for each Polaris surface: shopify-polaris-admin-extensions, shopify-polaris-checkout-extensions, shopify-polaris-customer-account-extensions, shopify-pos-ui. Installable standalone via `npx skills add Shopify/shopify-ai-toolkit`.",
      "snippet": {
        "language": "markdown",
        "source_url": "https://raw.githubusercontent.com/Shopify/shopify-ai-toolkit/HEAD/skills/shopify-polaris-app-home/SKILL.md",
        "content": "## Required Tool Calls (do not skip)\n\nYou have a `bash` tool. Every response must use it — in this order:\n\n1. Call `bash` with `scripts/search_docs.mjs \"<query>\"` — search before writing code\n2. Write the code using the search results\n3. Call `bash` with the following — validate before returning:\n   ```\n   scripts/validate.mjs --code '...' --user-prompt-base64 'BASE64_OF_USER_PROMPT' --session-id YOUR_SESSION_ID --tool-use-id YOUR_TOOL_USE_ID --model YOUR_MODEL_NAME --client-name YOUR_CLIENT_NAME --client-version YOUR_CLIENT_VERSION --artifact-id YOUR_ARTIFACT_ID --revision REVISION_NUMBER\n   ```\n4. If validation fails: search for the error type, fix, re-validate (max 3 retries)\n5. Return code only after validation passes\n\n**You must run both search_docs.mjs and validate.mjs in every response. Do not return code to the user without completing step 3.**"
      }
    },
    {
      "type": "mcp-server",
      "name": "@shopify/dev-mcp (Shopify Dev MCP server)",
      "official": true,
      "audience": "consumers",
      "code_url": "https://www.npmjs.com/package/@shopify/dev-mcp",
      "docs_url": "https://shopify.dev/docs/api/polaris/using-mcp",
      "description": "Official local MCP server (`npx -y @shopify/dev-mcp@latest`, v1.14.3, 2026-07-16). Exposes learn_shopify_api, search_docs_chunks, validate_component_codeblocks, validate_graphql_codeblocks, validate_theme, validate_theme_codeblocks. `validate_component_codeblocks` takes an `api` argument whose Polaris value is the literal string `polaris-app-home` (also `storefront-web-components`, `pos-ui`).",
      "notes": "Polaris support landed 2025-05-21 in early access behind `POLARIS_UNIFIED=true`; that env flag no longer appears anywhere in the 1.14.3 bundle, i.e. Polaris validation is now on by default. Internally marked `visibility: EARLY_ACCESS`.",
      "snippet": {
        "language": "json",
        "source_url": "https://shopify.dev/docs/api/polaris/using-mcp",
        "content": "{\n  \"mcpServers\": {\n    \"shopify-dev-mcp\": {\n      \"command\": \"npx\",\n      \"args\": [\"-y\", \"@shopify/dev-mcp@latest\"]\n    }\n  }\n}"
      }
    },
    {
      "type": "registry",
      "name": "Shopify AI Toolkit multi-host plugin distribution",
      "official": true,
      "audience": "consumers",
      "code_url": "https://github.com/Shopify/shopify-ai-toolkit",
      "description": "One repo published simultaneously as a Claude Code plugin (.claude-plugin), Codex plugin (.codex-plugin), Cursor plugin (.cursor-plugin), Hermes plugin (.hermes-plugin), Gemini/Antigravity extension (gemini-extension.json), and VS Code agent plugin, each with a one-line install command in the README. This is ‘distributed editor rules’ taken to its logical end: the DS team ships the rules into every agent host rather than hoping consumers copy a .cursorrules.",
      "snippet": {
        "language": "markdown",
        "source_url": "https://raw.githubusercontent.com/Shopify/shopify-ai-toolkit/HEAD/README.md",
        "content": "- **For Claude Code**: In your terminal, run `claude plugin install`:\n\n  ```\n  claude plugin install shopify-ai-toolkit@claude-plugins-official\n  ```\n\n- **For OpenAI Codex**: In your terminal, run `codex plugin add`:\n\n  ```\n  codex plugin add shopify@openai-curated\n  ```\n\n- **For Antigravity CLI**: In your terminal, install the Shopify plugin:\n\n  ```\n  agy plugin install https://github.com/Shopify/shopify-ai-toolkit\n  ```\n\n- **For Cursor**: In Cursor Chat, add the Shopify plugin:\n\n  ```\n  /add-plugin shopify\n  ```"
      }
    },
    {
      "type": "other",
      "name": "AI-crawler blocklist + noai meta (anti-affordance)",
      "official": true,
      "audience": "consumers",
      "docs_url": "https://polaris-react.shopify.com/robots.txt",
      "description": "The legacy Polaris docs site does the opposite of an llms.txt: it disallows every major AI crawler and tags each page `noai, noimageai`. Worth recording as a deliberate design choice: Shopify wants agents fetching Polaris knowledge through its instrumented MCP/skill channel, not scraping the deprecated React docs.",
      "snippet": {
        "language": "text",
        "source_url": "https://polaris-react.shopify.com/robots.txt",
        "content": "# Block OpenAI's crawler\nUser-agent: GPTBot\nDisallow: /\n\n# Block Anthropic's crawler\nUser-agent: ClaudeBot\nDisallow: /\n\n# Block Google's AI crawler\nUser-agent: Google-Extended\nDisallow: /\n\n# Block Perplexity\nUser-agent: PerplexityBot\nDisallow: /\n\n# Block Meta/Facebook AI\nUser-agent: FacebookBot\nDisallow: /\n\n# Block other common AI crawlers\nUser-agent: Omgilibot\nDisallow: /\nUser-agent: Omgili\nDisallow: /\nUser-agent: CCBot\nDisallow: /\nUser-agent: ChatGPT-User\nDisallow: /"
      }
    },
    {
      "type": "other",
      "name": "@shopify/polaris-types (machine-readable component contract)",
      "official": true,
      "audience": "consumers",
      "code_url": "https://www.npmjs.com/package/@shopify/polaris-types",
      "description": "v1.0.7 (2026-04-29). Ships the `s-*` custom-element JSX declarations that both the skill’s validate.mjs and the MCP validate_component_codeblocks tool typecheck generated code against. This is the registry: the type declarations ARE the machine-readable source of truth about valid components, props and prop values.",
      "notes": "validate.mjs bundles the TypeScript compiler and builds a virtual FS (lib.es5.d.ts, lib.es2020.d.ts, lib.dom.d.ts + the Polaris .d.ts) so the check runs locally without npm install."
    },
    {
      "type": "mcp-server",
      "name": "polaris-mcp-server (community)",
      "official": false,
      "audience": "consumers",
      "code_url": "https://github.com/shramiknakarmi/polaris-mcp",
      "description": "‘Shopify Polaris UI Components MCP Server for AI assistants’, v1.0.0 published 2025-04-18 and never updated. Targets the now-deprecated React library. Also republished as @shramiknakarmi/polaris-mcp-server. Effectively abandoned; listed for completeness.",
      "notes": "Single release, ~15 months stale, points at the archived React API surface."
    },
    {
      "type": "storybook-integration",
      "name": "storybook.polaris.shopify.dev",
      "official": true,
      "audience": "both",
      "docs_url": "https://storybook.polaris.shopify.dev",